Rank,Word,CEFR,PartOfSpeech,IPA_UK,Chinese,Collocation,Example_EN,Example_CN,Synonym,Antonym,MemoryTip
2701,harbor,B2,noun;verb,/ˈhɑːbə(r)/,港口；怀有（美拼）,safe harbor;harbor a grudge;in the harbor,Fishing boats returned to the harbor before sunset.,渔船日落前返回港口。,port;shelter,,harbor＝harbour（英）：港湾。
2702,comedy,B2,noun,/ˈkɒmədi/,喜剧,romantic comedy;stand-up comedy;comedy show,We watched a comedy that made everyone laugh.,我们看了一部让大家发笑的喜剧。,humour;farce,tragedy,comedy：喜剧。
2703,chase,B2,verb;noun,/tʃeɪs/,追逐,chase after;car chase;give chase,The dog tried to chase the ball across the park.,狗想追着球跑过公园。,pursue;hunt,,chase：追赶。
2704,storage,B2,noun,/ˈstɔːrɪdʒ/,储存；仓库,storage space;data storage;in storage,We rented extra storage space for the winter.,我们租了额外仓存放冬季用品。,warehouse;keeping,,store → storage：储存。
2705,universe,B2,noun,/ˈjuːnɪvɜːs/,宇宙,the universe;expanding universe;across the universe,Scientists still debate how the universe began.,科学家仍在争论宇宙如何开始。,cosmos;world,,uni + verse：统一整体→宇宙。
2706,horrible,B2,adj.,/ˈhɒrəbl/,可怕的；极坏的,horrible news;horrible weather;feel horrible,What horrible weather we had on holiday!,我们假期时天气糟透了！,awful;terrible,wonderful,horror → horrible：可怕的。
2707,sheep,B2,noun,/ʃiːp/,绵羊,flock of sheep;sheep farm;count sheep,A flock of sheep moved slowly across the hill.,一群绵羊缓缓走过山丘。,ewe;lamb,,sheep：单复数同形。
2708,lover,B2,noun,/ˈlʌvə(r)/,爱人；爱好者,music lover;secret lover;lovers of art,He is a lover of classical music and opera.,他热爱古典音乐与歌剧。,admirer;fan,,love → lover：爱好者或情人。
2709,rat,B2,noun,/ræt/,老鼠,sewer rat;lab rat;smell a rat,They found a rat in the empty warehouse.,他们在空仓库里发现一只老鼠。,rodent,,rat：大鼠。
2710,portrait,B2,noun,/ˈpɔːtreɪt/,肖像,self-portrait;family portrait;paint a portrait,The museum displays a famous royal portrait.,博物馆展出一幅著名的王室肖像。,likeness;picture,,portrait：肖像画。
2711,innocent,B2,adj.,/ˈɪnəsnt/,无辜的；天真的,innocent child;prove innocent;innocent of,The court found him innocent of all charges.,法庭认定他所有指控均不成立。,guiltless;blameless,guilty,in + nocent：无害→无辜。
2712,substitute,B2,noun;verb,/ˈsʌbstɪtjuːt/,代替者；代替,substitute teacher;substitute for;substitute sugar,You can substitute honey for sugar in this recipe.,这道食谱可用蜂蜜代替糖。,replacement;replace,,sub + stitute：放在下面→替代。
2713,supplement,B2,noun;verb,/ˈsʌplɪmənt/,补充；增刊,food supplement;supplement income;vitamin supplement,She takes a vitamin supplement every morning.,她每天早上服用维生素补充剂。,addition;extra,,supplement：补充物。
2714,adjustment,B2,noun,/əˈdʒʌstmənt/,调整；适应,make an adjustment;price adjustment;period of adjustment,A small adjustment improved the machine's speed.,一次小调整提高了机器速度。,modification;change,,adjust → adjustment：调整。
2715,reasonably,B2,adv.,/ˈriːznəbli/,合理地；相当地,reasonably priced;reasonably sure;act reasonably,The hotel was clean and reasonably priced.,酒店干净且价格合理。,fairly;sensibly,unreasonably,reason → reasonably：合理地。
2716,filter,B2,noun;verb,/ˈfɪltə(r)/,过滤器；过滤,water filter;filter out;coffee filter,A water filter removes dirt from the tap water.,滤水器去除自来水中的杂质。,screen;strain,,filter：过滤。
2717,flexible,B2,adj.,/ˈfleksəbl/,灵活的；柔韧的,flexible hours;flexible plan;stay flexible,The job offers flexible working hours for parents.,这份工作为家长提供弹性工时。,adaptable;bendy,rigid,flex → flexible：可弯曲的。
2718,abstract,B2,adj.;noun,/ˈæbstrækt/,抽象的；摘要,abstract idea;abstract art;in the abstract,Young children prefer concrete examples to abstract ideas.,幼儿更喜欢具体例子而非抽象概念。,conceptual;summary,concrete,abstract：抽象的，或摘要。
2719,tent,B2,noun,/tent/,帐篷,pitch a tent;camping tent;sleep in a tent,We pitched a tent beside the quiet lake.,我们在安静的湖边搭了帐篷。,shelter;camp,,tent：帐篷。
2720,precise,B2,adj.,/prɪˈsaɪs/,精确的,precise measurement;precise moment;be precise,Please give a precise measurement of the room.,请给出房间的精确尺寸。,exact;accurate,rough,precise：精准。
2721,distant,B2,adj.,/ˈdɪstənt/,遥远的；疏远的,distant past;distant relative;seem distant,We could see distant mountains after the rain.,雨后看得见远处的山。,far;remote,near;close,distance → distant：远的。
2722,stranger,B2,noun,/ˈstreɪndʒə(r)/,陌生人,complete stranger;talk to a stranger;stranger in town,Never accept a lift from a stranger.,绝不要搭陌生人的便车。,unknown person,friend;acquaintance,strange → stranger：陌生人。
2723,shade,B2,noun;verb,/ʃeɪd/,荫凉；色调；遮挡,in the shade;lamp shade;shade your eyes,Let's sit in the shade under that tree.,我们坐到那棵树荫下吧。,shadow;tint,sunlight,shade：阴影、色度。
2724,grain,B2,noun,/ɡreɪn/,谷物；颗粒,grain of rice;whole grain;against the grain,Farmers stored the grain before the winter storm.,农民在冬季风暴前存好谷物。,cereal;particle,,grain：谷粒。
2725,situate,B2,verb,/ˈsɪtʃueɪt/,使位于；安置,situate in;be situated;situate a building,They plan to situate the new library near the park.,他们计划把新图书馆建在公园附近。,locate;place,,situation → situate：放置于。
2726,summarize,B2,verb,/ˈsʌməraɪz/,总结（美拼）,summarize the text;summarize briefly;summarize findings,Please summarize the article in five sentences.,请用五句话总结这篇文章。,sum up;outline,,summarize＝summarise（英）：概括。
2727,leap,B2,verb;noun,/liːp/,跳跃；飞跃,leap forward;leap of faith;quantum leap,The cat can leap onto the high wall easily.,猫能轻松跳上高墙。,jump;bound,,leap：跳跃。
2728,snap,B2,verb;noun;adj.,/snæp/,突然折断；快照；急躁的,snap photo;snap shut;in a snap,The dry branch will snap if you stand on it.,干树枝你一踩就会折断。,break;click,,snap：啪地折断或快拍。
2729,probability,B2,noun,/ˌprɒbəˈbɪləti/,可能性；概率,high probability;probability of;in all probability,There is a high probability of rain tomorrow.,明天下雨的可能性很高。,likelihood;chance,impossibility,probable → probability：概率。
2730,leather,B2,noun;adj.,/ˈleðə(r)/,皮革；皮的,leather jacket;genuine leather;leather bag,He wore a black leather jacket to the concert.,他穿黑色皮夹克去听演唱会。,hide;skin,,leather：皮革。
2731,uncertainty,B2,noun,/ʌnˈsɜːtnti/,不确定；不确定性,economic uncertainty;uncertainty about;live with uncertainty,Economic uncertainty worries many young workers.,经济不确定性令许多年轻员工担忧。,doubt;unpredictability,certainty,un + certainty：不确定。
2732,swear,B2,verb,/sweə(r)/,发誓；咒骂,swear an oath;swear at;swear by,Witnesses must swear to tell the truth in court.,证人必须在法庭上发誓说实话。,vow;curse,,swear：发誓或骂人。
2733,refugee,B2,noun,/ˌrefjuˈdʒiː/,难民,war refugee;refugee camp;refugee family,The charity helps refugee families find housing.,慈善机构帮助难民家庭找到住房。,asylum seeker;displaced person,,refuge → refugee：寻求庇护者。
2734,shore,B2,noun,/ʃɔː(r)/,岸；滨,sea shore;off shore;reach the shore,Children collected shells along the shore.,孩子们沿海岸捡贝壳。,coast;beach,,shore：海岸。
2735,monthly,B2,adj.;adv.,/ˈmʌnθli/,每月的；每月地,monthly rent;monthly meeting;paid monthly,Rent is paid monthly on the first day.,租金每月一日支付。,each month,,month + ly：每月。
2736,comprise,B2,verb,/kəmˈpraɪz/,包含；由……组成,comprise three parts;the group comprises;fully comprise,The team comprises players from six countries.,该队由六个国家的选手组成。,consist of;include,,comprise：整体包含部分（慎用 of）。
2737,stir,B2,verb;noun,/stɜː(r)/,搅拌；引起轰动,stir the soup;stir up;cause a stir,Stir the soup gently so it does not burn.,轻轻搅拌汤以免糊锅。,mix;arouse,,stir：搅动。
2738,excitement,B2,noun,/ɪkˈsaɪtmənt/,兴奋,sense of excitement;full of excitement;share the excitement,There was great excitement before the final match.,决赛前气氛非常兴奋。,thrill;enthusiasm,boredom,excite → excitement：兴奋。
2739,sigh,B2,verb;noun,/saɪ/,叹息,sigh with relief;deep sigh;heave a sigh,She gave a sigh of relief when the test ended.,考试结束时她松了口气。,exhale;groan,,sigh：叹气。
2740,pregnancy,B2,noun,/ˈpreɡnənsi/,怀孕；妊娠,during pregnancy;early pregnancy;healthy pregnancy,She stopped coffee during pregnancy on doctor's advice.,怀孕期间她按医嘱戒了咖啡。,gestation,,pregnant → pregnancy：妊娠。
2741,experimental,B2,adj.,/ɪkˌsperɪˈmentl/,实验的；试验性的,experimental study;experimental theatre;still experimental,The drug is still at an experimental stage.,该药仍处于试验阶段。,trial;test,proven,experiment → experimental：实验性的。
2742,institutional,B2,adj.,/ˌɪnstɪˈtjuːʃənl/,机构的；制度的,institutional change;institutional support;institutional racism,The reform needs strong institutional support.,改革需要强有力的制度支持。,organisational;official,,institution → institutional：机构的。
2743,slice,B2,noun;verb,/slaɪs/,薄片；切开,slice of bread;slice thin;pizza slice,Would you like another slice of bread?,还想再来一片面包吗？,piece;cut,,slice：薄片。
2744,wander,B2,verb,/ˈwɒndə(r)/,漫步；走神,wander around;wander off;mind wander,We like to wander around the old town at dusk.,我们喜欢黄昏时在古镇漫步。,roam;stroll,,wander：闲逛（勿与 wonder 混淆）。
2745,empire,B2,noun,/ˈempaɪə(r)/,帝国,Roman Empire;build an empire;business empire,The Roman Empire left roads across Europe.,罗马帝国在欧洲留下许多道路。,realm;domain,,empire：帝国。
2746,subsequently,B2,adv.,/ˈsʌbsɪkwəntli/,随后；后来,subsequently decide;and subsequently;subsequently found,He moved to Leeds and subsequently found a better job.,他迁到利兹，随后找到更好工作。,later;afterwards,previously,subsequent + ly：随后。
2747,gentle,B2,adj.,/ˈdʒentl/,温和的；轻柔的,gentle voice;gentle slope;be gentle,Please be gentle with the newborn kitten.,请温柔对待刚出生的小猫。,mild;kind,harsh;rough,gentle：温柔。
2748,attendance,B2,noun,/əˈtendəns/,出席；到场人数,school attendance;take attendance;poor attendance,Regular attendance is required for this course.,本课程要求按时出勤。,presence;turnout,absence,attend → attendance：出勤。
2749,ownership,B2,noun,/ˈəʊnəʃɪp/,所有权,home ownership;transfer ownership;sense of ownership,Proof of ownership is needed to sell the car.,卖车需要所有权证明。,possession;title,,owner → ownership：所有权。
2750,qualification,B2,noun,/ˌkwɒlɪfɪˈkeɪʃn/,资格；学历,teaching qualification;required qualification;professional qualification,A teaching qualification is required for this post.,该职位需要教师资格。,credential;requirement,,qualify → qualification：资格。
2751,suspend,B2,verb,/səˈspend/,暂停；悬挂；暂令停学,suspend a service;suspend from school;suspend judgment,They will suspend the train service during repairs.,维修期间将暂停火车服务。,pause;hang,resume;continue,suspend：暂时中止。
2752,functional,B2,adj.,/ˈfʌŋkʃənl/,实用的；功能的,functional design;fully functional;functional clothes,The kitchen is small but highly functional.,厨房虽小但功能齐全。,practical;working,decorative;broken,function → functional：功能性的。
2753,voluntary,B2,adj.,/ˈvɒləntri/,自愿的；志愿的,voluntary work;voluntary organisation;on a voluntary basis,She does voluntary work at the local hospital.,她在当地医院做志愿工作。,optional;unpaid,compulsory,volunteer → voluntary：自愿的。
2754,pale,B2,adj.;verb,/peɪl/,苍白的；变苍白,look pale;pale face;pale comparison,You look pale; do you feel ill?,你脸色苍白，是不是不舒服？,colourless;wan,flushed;rosy,pale：苍白。
2755,stain,B2,noun;verb,/steɪn/,污渍；玷污,coffee stain;stain the carpet;remove a stain,Tomato sauce left a red stain on the shirt.,番茄酱在衬衫上留下红色污渍。,mark;spot,,stain：污渍。
2756,athlete,B2,noun,/ˈæθliːt/,运动员,Olympic athlete;professional athlete;train as an athlete,The athlete trains six days a week before big events.,这位运动员大赛前一周训练六天。,sportsperson;competitor,,athlete：运动员。
2757,organic,B2,adj.,/ɔːˈɡænɪk/,有机的；器官的,organic food;organic farm;organic growth,More people choose organic food for health reasons.,更多人因健康选择有机食品。,natural;biological,synthetic,organ → organic：有机的。
2758,tongue,B2,noun,/tʌŋ/,舌头；语言,mother tongue;bite your tongue;sharp tongue,"English is not her mother tongue, but she speaks it well.",英语不是她的母语，但她说得很好。,language;speech,,tongue：舌头或语言。
2759,server,B2,noun,/ˈsɜːvə(r)/,服务器；侍者,file server;web server;restaurant server,The website was down because the server failed.,网站因服务器故障而瘫痪。,host;waiter,,serve → server：服务器/侍者。
2760,structural,B2,adj.,/ˈstrʌktʃərəl/,结构的,structural change;structural damage;structural problem,Engineers checked the bridge for structural damage.,工程师检查桥梁是否有结构损坏。,framework-related;organisational,,structure → structural：结构性的。
2761,fool,B2,noun;verb,/fuːl/,傻瓜；愚弄,make a fool of;fool around;fool someone,Don't let them fool you with false promises.,别让虚假承诺愚弄你。,idiot;trick,genius,fool：傻子或欺骗。
2762,alongside,B2,prep.;adv.,/əˌlɒŋˈsaɪd/,在……旁边；与……一起,work alongside;alongside the road;place alongside,She worked alongside two nurses in the clinic.,她在诊所与两名护士并肩工作。,beside;with,,along + side：在侧面。
2763,unite,B2,verb,/juˈnaɪt/,联合；团结,unite against;unite the party;stand united,The leaders called on the country to unite for peace.,领袖们呼吁全国团结求和平。,join;combine,divide;split,unit → unite：使联合。
2764,gently,B2,adv.,/ˈdʒentli/,轻轻地；温柔地,speak gently;close gently;gently push,Hold the glass gently so it does not break.,轻轻拿着杯子以免打碎。,softly;tenderly,roughly,gentle + ly：轻轻地。
2765,compute,B2,verb,/kəmˈpjuːt/,计算,compute the cost;compute data;quick to compute,The program can compute the total cost in seconds.,该程序几秒内就能算出总费用。,calculate;work out,,compute：计算（computer 之根）。
2766,wipe,B2,verb;noun,/waɪp/,擦拭,wipe clean;wipe away;wet wipe,Please wipe the table after dinner.,晚饭后请把桌子擦干净。,clean;rub,,wipe：擦掉。
2767,weird,B2,adj.,/wɪəd/,古怪的,weird noise;feel weird;weird habit,We heard a weird noise coming from the cellar.,我们听见地窖传来奇怪的声音。,strange;odd,normal,weird：怪异。
2768,gaze,B2,verb;noun,/ɡeɪz/,凝视,gaze at;steady gaze;gaze into,She sat by the window to gaze at the stars.,她坐在窗边凝视星空。,stare;look,,gaze：长时间看。
2769,fade,B2,verb,/feɪd/,褪色；逐渐消失,fade away;colours fade;fade into,The curtains will fade if left in strong sun.,窗帘若一直晒在烈日下会褪色。,dim;disappear,brighten,fade：褪去。
2770,cough,B2,verb;noun,/kɒf/,咳嗽,dry cough;cough up;bad cough,Cover your mouth when you cough in public.,在公共场合咳嗽时请捂住嘴。,hack,,cough：咳嗽。
2771,hypothesis,B2,noun,/haɪˈpɒθəsɪs/,假说；假设,test a hypothesis;working hypothesis;scientific hypothesis,Scientists tested the hypothesis with a new experiment.,科学家用新实验检验该假说。,theory;assumption,,hypo + thesis：置于之下的论断。
2772,royal,B2,adj.;noun,/ˈrɔɪəl/,王室的；王室成员,royal family;royal palace;royal visit,Crowds waited for the royal visit to the city.,人群等候王室造访这座城市。,regal;kingly,,royal：皇家的。
2773,theoretical,B2,adj.,/ˌθɪəˈretɪkl/,理论的,theoretical knowledge;theoretical model;purely theoretical,The course covers both practical and theoretical skills.,本课程涵盖实践与理论技能。,abstract;conceptual,practical,theory → theoretical：理论的。
2774,curtain,B2,noun,/ˈkɜːtn/,窗帘；幕,draw the curtain;stage curtain;behind the curtain,Please draw the curtain; the sun is too bright.,请把窗帘拉上，阳光太刺眼。,drape;screen,,curtain：窗帘/帷幕。
2775,mayor,B2,noun,/meə(r)/,市长,city mayor;elect a mayor;mayor of,The mayor opened the new sports centre today.,市长今天为新体育中心揭幕。,city leader,,mayor：市长。
2776,darkness,B2,noun,/ˈdɑːknəs/,黑暗,in darkness;complete darkness;fall into darkness,We walked home carefully in complete darkness.,我们在完全黑暗中小心走回家。,gloom;night,light;brightness,dark → darkness：黑暗。
2777,aunt,B2,noun,/ɑːnt/,姑母；姨母；伯母,my aunt;aunt and uncle;visit Aunt Mary,My aunt lives in Bristol and visits each Easter.,我姨妈住在布里斯托，每年复活节来访。,parent's sister,uncle,aunt：姨妈/姑妈。
2778,tournament,B2,noun,/ˈtʊənəmənt/,锦标赛,tennis tournament;win a tournament;chess tournament,Our school team entered the city tennis tournament.,我校队伍参加了全市网球赛。,competition;championship,,tournament：淘汰赛/锦标赛。
2779,registration,B2,noun,/ˌredʒɪˈstreɪʃn/,登记；注册,course registration;car registration;registration fee,Online course registration closes next Friday.,在线选课注册下周五截止。,enrolment;record,,register → registration：注册。
2780,fragment,B2,noun;verb,/ˈfræɡmənt/,碎片；使碎裂,glass fragment;fragment of text;break into fragments,Workers cleared glass fragments from the road.,工人清理路上的玻璃碎片。,piece;shard,whole,fragment：碎片。
2781,listener,B2,noun,/ˈlɪsənə(r)/,听众；倾听者,good listener;radio listener;careful listener,A good listener can calm a worried friend.,善于倾听的人能安抚忧虑的朋友。,audience member;hearer,speaker,listen → listener：听者。
2782,tender,B2,adj.;verb;noun,/ˈtendə(r)/,温柔的；嫩的；投标,tender meat;tender care;submit a tender,Cook the meat until it is soft and tender.,把肉煮到软嫩即可。,gentle;soft,tough;harsh,tender：柔嫩或温和。
2783,density,B2,noun,/ˈdensəti/,密度,population density;high density;density of,Tokyo has a very high population density.,东京人口密度很高。,concentration;thickness,,dense → density：密度。
2784,ugly,B2,adj.,/ˈʌɡli/,丑陋的；令人不快的,ugly building;ugly truth;ugly mood,An ugly concrete wall blocks the river view.,一道难看的混凝土墙挡住了河景。,unattractive;hideous,beautiful,ugly：丑。
2785,module,B2,noun,/ˈmɒdjuːl/,模块；单元,course module;software module;learning module,This course module ends with a short test.,本课程单元以一次小测验结束。,unit;section,,module：模块。
2786,faithfully,B2,adv.,/ˈfeɪθfəli/,忠实地；如实地,serve faithfully;yours faithfully;report faithfully,She served the company faithfully for thirty years.,她忠实服务公司三十年。,loyally;truly,faithlessly,faithful + ly：忠实地。
2787,autumn,B2,noun,/ˈɔːtəm/,秋天（英）,autumn leaves;in autumn;late autumn,The trees turn gold and red in autumn.,秋天树叶变得金黄与绯红。,fall,spring,autumn：英式秋天（美 fall）。
2788,cheek,B2,noun,/tʃiːk/,脸颊；厚颜,rosy cheek;kiss on the cheek;tongue in cheek,The cold wind made her cheeks turn pink.,冷风把她的脸颊吹红了。,face side,,cheek：面颊。
2789,attachment,B2,noun,/əˈtætʃmənt/,附件；依恋,email attachment;emotional attachment;sense of attachment,Please open the email attachment carefully.,请小心打开邮件附件。,bond;appendix,,attach → attachment：附着/附件。
2790,holder,B2,noun,/ˈhəʊldə(r)/,持有人；支架,ticket holder;record holder;cup holder,Ticket holders should enter through Gate B.,持票人请从 B 门进入。,owner;container,,hold → holder：持有者。
2791,grin,B2,verb;noun,/ɡrɪn/,露齿而笑,broad grin;grin at;grin with delight,He gave a broad grin when he saw the gift.,看到礼物时他咧嘴大笑。,smile;beam,frown,grin：咧嘴笑。
2792,noun,B2,noun,/naʊn/,名词,common noun;proper noun;countable noun,"In English, a proper noun usually starts with a capital letter.",英语中专有名词通常大写开头。,naming word,,noun：名词。
2793,fortunate,B2,adj.,/ˈfɔːtʃənət/,幸运的,fortunate enough;feel fortunate;fortunate event,We were fortunate to catch the last bus home.,我们幸运赶上末班回家。,lucky;blessed,unfortunate,fortune → fortunate：幸运的。
2794,alright,B2,adj.;adv.,/ɔːlˈraɪt/,好的；可以（非正式）,I'm alright;alright then;feel alright,Are you alright after the long flight?,长途飞行后你还好吗？,okay;fine,,alright≈all right：非正式拼写。
2795,lazy,B2,adj.,/ˈleɪzi/,懒惰的,lazy afternoon;feel lazy;lazy student,Don't be lazy; finish your homework first.,别偷懒，先做完作业。,idle;sluggish,hard-working,lazy：懒。
2796,hello,B2,exclam.;noun,/həˈləʊ/,你好,say hello;hello there;friendly hello,She always says hello to the neighbours.,她总是向邻居打招呼问好。,hi;good morning,goodbye,hello：问候语。
2797,hunger,B2,noun,/ˈhʌŋɡə(r)/,饥饿,die of hunger;hunger for;feel hunger,After the hike they felt sharp hunger.,徒步后他们感到强烈饥饿。,starvation;appetite,fullness,hunger：饿。
2798,insure,B2,verb,/ɪnˈʃʊə(r)/,给……保险；确保,insure a car;insure against;insure that,You must insure the car before you drive it.,开车前必须给车上保险。,cover;guarantee,,insure：投保（ensure＝确保，词义有别）。
2799,ashamed,B2,adj.,/əˈʃeɪmd/,羞愧的,feel ashamed;ashamed of;ashamed to,He felt ashamed of lying to his parents.,他为对父母撒谎感到羞愧。,embarrassed;guilty,proud,shame → ashamed：感到羞耻。
2800,found,B2,verb,/faʊnd/,创立；铸造（也是 find 的过去式）,found a company;found a school;newly found,They plan to found a small charity next year.,他们计划明年创办一个小型慈善机构。,establish;set up,dissolve,found：创立（与 find 过去式同形）。
