Rank,Word,CEFR,PartOfSpeech,IPA_UK,Chinese,Collocation,Example_EN,Example_CN,Synonym,Antonym,MemoryTip
1401,moreover,A2,adv.,/mɔːrˈəʊvə(r)/,此外；而且,"moreover it;and moreover;moreover,","The plan is cheap; moreover, it is easy to try.",这个计划成本低；此外，也容易尝试。,furthermore;besides,,more + over：再往上多加一层说明。
1402,onto,A2,prep.,/ˈɒntu/,到……上面,onto the table;climb onto;hold onto,The cat jumped onto the sofa and fell asleep.,猫跳到沙发上睡着了。,on to,off,on + to：移动并落到某个表面上。
1403,historical,A2,adj.,/hɪˈstɒrɪkl/,历史的；史学的,historical event;historical novel;historical evidence,This castle has great historical importance for the town.,这座城堡对该镇有重要历史意义。,historic-related;past,modern,history → historical：与历史相关的（偏事实研究）。
1404,oppose,A2,verb,/əˈpəʊz/,反对；对抗,oppose a plan;strongly oppose;oppose to,Many residents oppose the plan to cut down the trees.,许多居民反对砍树的计划。,resist;object to,support,op + pose：站到对面去反对。
1405,branch,A2,noun; verb,/brɑːntʃ/,树枝；分店；分支,tree branch;bank branch;branch out,There is a new bank branch near the school gate.,学校门口附近新开了一家银行分行。,division;office,,branch：从主干分出去的一支。
1406,vehicle,A2,noun,/ˈviːɪkl/,车辆；交通工具,motor vehicle;electric vehicle;vehicle for,Electric vehicles are becoming more popular in cities.,电动车在城市里越来越受欢迎。,car;transport,,vehicle：把人从一处运到另一处的工具。
1407,scientist,A2,noun,/ˈsaɪəntɪst/,科学家,research scientist;scientist of;team of scientists,Scientists are looking for cleaner energy sources.,科学家们正在寻找更清洁的能源。,researcher,,science + ist：从事科学研究的人。
1408,route,A2,noun,/ruːt/,路线；途径,bus route;shortest route;en route,Which bus route goes to the city museum?,哪条公交线路去市博物馆？,path;way,,route：事先规划好怎么走。
1409,bind,A2,verb,/baɪnd/,捆绑；约束,bind together;bind to;legally bind,Please bind the papers with a strong rubber band.,请用结实的橡皮筋把文件捆好。,tie;oblige,untie,bind：把分散的东西绑牢（过去式 bound）。
1410,belong,A2,verb,/bɪˈlɒŋ/,属于；适应,belong to;belong here;belong together,These keys belong to the new flat upstairs.,这些钥匙属于楼上的新公寓。,own;fit in,,注意：主语常为物，belong to someone。
1411,taste,A2,noun; verb,/teɪst/,味道；品尝；品味,taste of;good taste;taste good,Would you like to taste this homemade soup?,你想尝尝这道自制汤吗？,flavour;sample,,taste：舌头品到的感觉。
1412,tonight,A2,adv.; noun,/təˈnaɪt/,今晚,later tonight;for tonight;tonight's,Are you free tonight for a short phone call?,你今晚有空通个短电话吗？,this evening,,to + night：就是这一夜。
1413,fashion,A2,noun,/ˈfæʃn/,时尚；方式,in fashion;fashion industry;out of fashion,Bright colours are in fashion again this summer.,亮色今年夏天又流行起来了。,style;trend,,fashion：大众一时追捧的样子。
1414,danger,A2,noun,/ˈdeɪndʒə(r)/,危险,in danger;danger of;out of danger,Swimming alone in deep water can put you in danger.,独自在深水游泳可能使你处于危险中。,risk;hazard,safety,danger：可能受伤的处境。
1415,bomb,A2,noun; verb,/bɒm/,炸弹；轰炸,car bomb;bomb attack;bomb the target,The film showed how journalists report from bomb sites carefully.,影片展示记者如何在爆炸现场谨慎报道。,explosive;blast,,bomb：爆炸装置；也作动词轰炸。
1416,army,A2,noun,/ˈɑːmi/,军队；陆军,join the army;army officer;army of,He joined the army after finishing university.,他大学毕业后参了军。,military;troops,,army：成建制的武装力量。
1417,dangerous,A2,adj.,/ˈdeɪndʒərəs/,危险的,dangerous road;dangerous for;highly dangerous,Icy roads are dangerous for drivers and bikes.,结冰的道路对驾驶员和骑行者都很危险。,risky;hazardous,safe,danger + ous：充满危险。
1418,decrease,A2,verb; noun,/dɪˈkriːs/; /ˈdiːkriːs/,减少；下降,decrease by;decrease in;sharp decrease,Noise levels decrease after the school buses leave.,校车离开后噪音水平下降。,reduce;decline,increase,de + crease：往下缩减。
1419,hurt,A2,verb; adj.; noun,/hɜːt/,伤害；疼痛,hurt yourself;get hurt;hurt feelings,Be careful not to hurt your back when you lift.,搬东西时小心别伤到背部。,injure;pain,heal,hurt：身体或心里感到疼。
1420,council,A2,noun,/ˈkaʊnsl/,委员会；地方议会,city council;council meeting;student council,The city council approved a new library building.,市议会批准修建一座新图书馆。,board;assembly,,council：一群人坐下来共同决策。
1421,editor,A2,noun,/ˈedɪtə(r)/,编辑,newspaper editor;chief editor;editor of,The editor asked the writer to shorten the article.,编辑要求作者把文章缩短。,reviser;publisher,,edit + or：对文稿动手改的人。
1422,normally,A2,adv.,/ˈnɔːməli/,通常；正常地,normally open;as normally;normally would,I normally wake up at half past six on weekdays.,工作日我通常六点半起床。,usually;ordinarily,rarely,normal + ly：按常态进行。
1423,sight,A2,noun,/saɪt/,视力；景象；看见,at first sight;out of sight;sight of,The mountains came into sight as the clouds lifted.,云散开后，群山映入眼帘。,vision;view,,sight：眼睛看见的那一幕。
1424,generate,A2,verb,/ˈdʒenəreɪt/,产生；生成,generate electricity;generate ideas;generate income,Wind farms generate clean electricity for the region.,风力发电场为该地区产生清洁电力。,produce;create,,gener-（产生）→ generate：生出新东西。
1425,gift,A2,noun,/ɡɪft/,礼物；天赋,birthday gift;gift for;gift of,She brought a small gift for her host family.,她给寄宿家庭带了一件小礼物。,present;talent,,gift：送给别人的东西，也指天生本事。
1426,delivery,A2,noun,/dɪˈlɪvəri/,递送；分娩；演讲方式,home delivery;delivery service;special delivery,Home delivery of groceries has grown rapidly.,食品杂货送货上门业务增长很快。,shipment;dispatch,,deliver → delivery：把东西送到的过程。
1427,deny,A2,verb,/dɪˈnaɪ/,否认；拒绝给予,deny that;deny access;deny someone something,He denied that he had broken the classroom window.,他否认自己打碎了教室的窗户。,reject;refuse,admit,deny：说“不是我，也不给你”。
1428,guest,A2,noun,/ɡest/,客人；嘉宾,hotel guest;guest of honour;invite a guest,Please make our guests feel welcome at dinner.,请让晚宴上的客人感到受欢迎。,visitor;invitee,host,guest：被邀请或来住的一方。
1429,anybody,A2,pron.,/ˈenibɒdi/,任何人,anybody else;anybody who;if anybody,Did anybody leave a message for me this morning?,今天早上有人给我留过言吗？,anyone,nobody,any + body：随便哪一个人。
1430,bedroom,A2,noun,/ˈbedruːm/,卧室,in the bedroom;spare bedroom;bedroom door,She painted the bedroom walls a soft blue.,她把卧室墙壁刷成了柔和的蓝色。,chamber,,bed + room：放床睡觉的房间。
1431,quote,A2,verb; noun,/kwəʊt/,引用；报价,quote from;quote a price;famous quote,Please quote the source when you use another writer's words.,使用其他作者的话时请注明出处。,cite;price,,quote：把别人说的原话拿出来。
1432,climb,A2,verb; noun,/klaɪm/,攀登；上升,climb up;climb a mountain;climb the stairs,They climbed the hill to watch the sunrise.,他们登上小山看日出。,ascend;scale,descend,climb：手脚并用往上走。
1433,basically,A2,adv.,/ˈbeɪsɪkli/,基本上；大体上,basically the same;basically means;well basically,The two plans are basically the same in cost.,这两项计划在费用上基本相同。,essentially;fundamentally,,basic + ally：抓住最基础的那一层。
1434,violence,A2,noun,/ˈvaɪələns/,暴力,domestic violence;act of violence;end violence,The programme teaches young people to reject violence.,该项目教导年轻人拒绝暴力。,force;aggression,peace,violent → violence：用武力伤害的行为。
1435,minister,A2,noun,/ˈmɪnɪstə(r)/,部长；大臣；牧师,prime minister;minister of;government minister,The education minister visited several local schools.,教育部长走访了几所当地学校。,secretary;cleric,,minister：政府里主管一部的高官。
1436,mainly,A2,adv.,/ˈmeɪnli/,主要地；大部分,mainly because;mainly used;consist mainly of,The audience consisted mainly of university students.,观众主要由大学生组成。,mostly;primarily,,main + ly：占主要部分。
1437,mouth,A2,noun,/maʊθ/,嘴；河口,open your mouth;by word of mouth;mouth of the river,Cover your mouth when you cough in public.,在公共场合咳嗽时请捂住嘴。,lips;opening,,mouth：说话吃饭的器官，也指路/河的出口。
1438,noise,A2,noun,/nɔɪz/,噪音；响声,make a noise;noise pollution;loud noise,Please don't make too much noise after ten o'clock.,十点以后请不要发出太大噪音。,sound;racket,silence,noise：不想听的刺耳声。
1439,manner,A2,noun,/ˈmænə(r)/,方式；举止（常复数 manners）,in a manner;table manners;manner of,She spoke in a calm and friendly manner.,她以平静友好的方式说话。,way;behaviour,,manner：做事的样子；manners＝礼貌。
1440,gun,A2,noun,/ɡʌn/,枪,gun control;point a gun;gun fire,The museum shows old guns from the last century.,博物馆展出上个世纪的老式枪支。,firearm;weapon,,gun：能发射子弹的武器。
1441,square,A2,noun; adj.,/skweə(r)/,广场；正方形；平方的,town square;square metre;square root,People gathered in the town square for the festival.,人们聚集在城镇广场过节。,plaza;fair,,square：四边相等的图形，也指开阔广场。
1442,occasion,A2,noun,/əˈkeɪʒn/,场合；时机,special occasion;on occasion;on this occasion,This restaurant is perfect for a special occasion.,这家餐厅非常适合特殊场合。,event;opportunity,,occasion：值得专门准备的那一回。
1443,familiar,A2,adj.,/fəˈmɪliə(r)/,熟悉的,familiar with;look familiar;familiar face,Are you familiar with this computer program?,你熟悉这个电脑程序吗？,well-known;acquainted,unfamiliar;strange,family 同源：像家里那样认识、了解。
1444,ignore,A2,verb,/ɪɡˈnɔː(r)/,忽视；不理睬,ignore advice;ignore a message;choose to ignore,Don't ignore warning signs on the mountain path.,不要忽视山路上的警告标志。,disregard;overlook,notice;heed,ignore：当作没看见。
1445,destroy,A2,verb,/dɪˈstrɔɪ/,毁坏；消灭,destroy evidence;destroy completely;fire destroyed,The storm destroyed several old wooden houses.,风暴毁坏了几栋旧木屋。,ruin;demolish,build;create,de + stroy：拆到不能用。
1446,affair,A2,noun,/əˈfeə(r)/,事务；事件；风流韵事,public affairs;love affair;current affairs,Current affairs programmes discuss today's news in detail.,时事节目详细讨论今日新闻。,matter;business,,affair：正在办理或发生的事。
1447,civil,A2,adj.,/ˈsɪvl/,民用的；公民的；有礼貌的,civil war;civil rights;civil engineer,Civil rights protect equal treatment under the law.,公民权利保障法律面前的平等对待。,civic;polite,military;rude,civil：与公民社会相关，也指文明有礼。
1448,locate,A2,verb,/ləʊˈkeɪt/,定位；找出位置,locate in;be located;locate a place,The hotel is located next to the central station.,酒店位于中央车站旁边。,find;situate,,locate：弄清或把某物放在某处。
1449,citizen,A2,noun,/ˈsɪtɪzn/,公民；市民,British citizen;senior citizen;good citizen,Every citizen has the right to vote in free elections.,每位公民都有权在自由选举中投票。,national;resident,,city → citizen：城市共同体的成员。
1450,temperature,A2,noun,/ˈtemprətʃə(r)/,温度；体温,high temperature;body temperature;room temperature,The temperature dropped below zero overnight.,气温一夜之间降到了零下。,heat;reading,,temperature：冷热程度的读数。
1451,gold,A2,noun; adj.,/ɡəʊld/,金；金色的,gold medal;gold jewellery;pure gold,She won a gold medal in the swimming race.,她在游泳比赛中赢得了金牌。,golden metal,,gold：贵重的黄色金属。
1452,domestic,A2,adj.,/dəˈmestɪk/,国内的；家庭的,domestic flight;domestic market;domestic violence,Domestic flights are usually cheaper than international ones.,国内航班通常比国际航班便宜。,home;national,foreign;international,dom-（家）→ domestic：家里的，或国境之内的。
1453,load,A2,noun; verb,/ləʊd/,负荷；装载,heavy load;load a truck;load of,Workers began to load boxes onto the lorry.,工人开始把箱子装上卡车。,cargo;burden,unload,load：扛着的份量，或往上装。
1454,belief,A2,noun,/bɪˈliːf/,信念；信仰,strong belief;beyond belief;belief in,She has a strong belief in the value of education.,她坚信教育的价值。,faith;conviction,doubt,believe → belief：心里认定的东西。
1455,troop,A2,noun,/truːp/,部队；一群（常复数 troops）,ground troops;troop movement;boy scout troop,Troops were sent to help after the earthquake.,地震后派出了部队协助救灾。,soldiers;group,,troop(s)：成建制行动的军人群体。
1456,technical,A2,adj.,/ˈteknɪkl/,技术的；专业的,technical problem;technical support;technical skill,Call technical support if the software fails to open.,如果软件打不开，请致电技术支持。,specialised;technological,,techn-（技艺）→ technical：偏操作与专业细节。
1457,remind,A2,verb,/rɪˈmaɪnd/,提醒；使想起,remind someone of;remind about;just to remind,Please remind me to call the hotel tomorrow.,请提醒我明天给酒店打电话。,jog memory;prompt,,re + mind：让某事再次进入脑海。
1458,arrangement,A2,noun,/əˈreɪndʒmənt/,安排；布置,make arrangements;seating arrangement;by arrangement,We made travel arrangements for the school trip last week.,我们上周做好了学校旅行的行程安排。,plan;organisation,,arrange → arrangement：安排好的结果。
1459,skin,A2,noun,/skɪn/,皮肤；外皮,dry skin;skin care;thick skin,Use cream if your skin feels dry in winter.,冬天皮肤干燥时请使用面霜。,hide;complexion,,skin：包住身体最外的那一层。
1460,prison,A2,noun,/ˈprɪzn/,监狱,in prison;prison sentence;prison officer,The judge sent him to prison for five years.,法官判处他五年监禁。,jail;gaol,,prison：关押犯人的地方。
1461,switch,A2,verb; noun,/swɪtʃ/,转换；开关,switch on;switch off;light switch,Please switch off the lights when you leave.,离开时请关掉电灯。,change;toggle,,switch：拨一下就换到另一边。
1462,acquire,A2,verb,/əˈkwaɪə(r)/,获得；习得,acquire knowledge;acquire skills;acquire a company,Children acquire language skills through daily conversation.,儿童通过日常对话习得语言技能。,obtain;gain,lose,acquire：经过过程把某物变成自己的。
1463,corporate,A2,adj.,/ˈkɔːpərət/,公司的；法人的,corporate culture;corporate tax;corporate client,Corporate culture can affect how staff work together.,企业文化会影响员工如何协作。,company;business,,corporation → corporate：大公司层面的。
1464,fairly,A2,adv.,/ˈfeəli/,相当；公平地,fairly good;fairly easy;treat fairly,The test was fairly easy if you had revised well.,如果复习充分，这次考试相当容易。,quite;justly,unfairly,fair + ly：还算可以，或办事公平。
1465,wood,A2,noun,/wʊd/,木头；木材；树林,made of wood;wood floor;in the woods,This table is made of strong local wood.,这张桌子由当地结实的木材制成。,timber;forest,,wood：树加工后的材料；woods＝树林。
1466,participate,A2,verb,/pɑːˈtɪsɪpeɪt/,参加；参与,participate in;actively participate;participate fully,All students are invited to participate in the sports day.,欢迎全体学生参加运动会。,take part;join,withdraw,part + icipate：成为活动的一部分。
1467,tough,A2,adj.,/tʌf/,艰难的；坚韧的,tough decision;tough time;tough question,Choosing a university can be a tough decision.,选择大学可能是艰难的决定。,hard;strong,easy;soft,tough：咬不动、也撑得住。
1468,tear,A2,verb; noun,/teə(r)/; /tɪə(r)/,撕破；眼泪,tear up;in tears;tear apart,Don't tear the page out of the library book.,不要从图书馆的书上撕下书页。,rip;cry,mend,撕破读 /teə/；眼泪常读 /tɪə/。
1469,representative,A2,noun; adj.,/ˌreprɪˈzentətɪv/,代表；有代表性的,sales representative;elected representative;representative of,Each class chose a representative for the student council.,每个班级选了一名学生会代表。,delegate;typical,,represent → representative：替大家说话的人。
1470,capacity,A2,noun,/kəˈpæsəti/,容量；能力,full capacity;seating capacity;capacity to,The hall was filled to capacity for the concert.,音乐会时大厅座无席满。,ability;volume,,capacity：能装多少，或能做到什么。
1471,border,A2,noun; verb,/ˈbɔːdə(r)/,边界；接壤,cross the border;border town;border on,You need a passport to cross the national border.,跨越国境需要护照。,boundary;edge,,border：两国或两地之间的那条线。
1472,shake,A2,verb; noun,/ʃeɪk/,摇动；握手；震动,shake hands;shake your head;milkshake,They shook hands and agreed to work together.,他们握手并同意共事。,tremble;jolt,,shake：迅速来回晃。
1473,assessment,A2,noun,/əˈsesmənt/,评估；评定,risk assessment;continuous assessment;assessment of,The final assessment includes a written test and a project.,期末评估包括笔试和项目作业。,evaluation;appraisal,,assess → assessment：测一测水平如何。
1474,shoe,A2,noun,/ʃuː/,鞋,pair of shoes;shoe shop;put on shoes,Wipe your shoes before you enter the house.,进屋前请擦一下鞋子。,footwear,,shoe：保护双脚、成双成对。
1475,ought,A2,modal verb,/ɔːt/,应当；应该,ought to;ought not;you ought,You ought to check the weather before you leave.,出门前你应当查看天气。,should,,ought to ≈ should：道德或合理上该做。
1476,ad,A2,noun,/æd/,广告（advertisement 缩写）,job ad;newspaper ad;run an ad,I found this flat through an online housing ad.,我是通过网上的租房广告找到这套公寓的。,advert;advertisement,,ad＝advertisement：简短广告。
1477,fee,A2,noun,/fiː/,费用；酬金,entrance fee;tuition fee;service fee,The museum entrance fee is free for children under five.,五岁以下儿童免收博物馆门票费。,charge;cost,,fee：为服务或进入权付的钱。
1478,hall,A2,noun,/hɔːl/,大厅；礼堂；走廊,town hall;school hall;concert hall,Parents waited in the hall outside the exam room.,家长在考场外的大厅等候。,lobby;auditorium,,hall：宽敞可供多人聚集的室内空间。
1479,regulation,A2,noun,/ˌreɡjuˈleɪʃn/,规定；条例,safety regulation;government regulation;strict regulation,New safety regulations require helmets on all building sites.,新安全条例要求所有建筑工地佩戴头盔。,rule;law,,regulate → regulation：用来规范行为的条文。
1480,escape,A2,verb; noun,/ɪˈskeɪp/,逃跑；逃脱,escape from;narrow escape;escape the heat,Two rabbits escaped from their cage last night.,昨晚两只兔子从笼子里逃了出来。,flee;getaway,capture,escape：从困住你的地方溜走。
1481,studio,A2,noun,/ˈstjuːdiəʊ/,工作室；演播室；画室,recording studio;art studio;film studio,The band recorded their first album in a small studio.,乐队在一个小录音棚录制了第一张专辑。,workshop;atelier,,studio：专心创作或录制的房间。
1482,proper,A2,adj.,/ˈprɒpə(r)/,适当的；正当的,proper way;proper care;at the proper time,Wear proper shoes when you go hiking in the hills.,在山里徒步时请穿合适的鞋子。,suitable;correct,improper,proper：符合规矩、恰到好处。
1483,relax,A2,verb,/rɪˈlæks/,放松；松懈,relax and enjoy;relax your muscles;time to relax,"After exams, students need time to relax with friends.",考试结束后，学生需要与朋友一起放松。,rest;unwind,tense,re + lax：让紧绷松开。
1484,tourist,A2,noun,/ˈtʊərɪst/,游客；旅行者,foreign tourist;tourist attraction;tourist information,Tourists take photos outside the old palace every day.,游客每天都在古老宫殿外拍照。,visitor;traveller,,tour + ist：以观光为目的的人。
1485,component,A2,noun,/kəmˈpəʊnənt/,部件；组成部分,key component;component of;electronic component,Trust is a key component of good teamwork.,信任是良好团队合作的关键组成部分。,part;element,whole,com + ponent：拼进整体里的一块。
1486,afford,A2,verb,/əˈfɔːd/,买得起；承担得起,can afford;afford to;afford the time,We cannot afford to waste another week on this error.,我们不能再浪费一周在这个错误上。,have money for;spare,,afford：口袋和时间都扛得住。
1487,lawyer,A2,noun,/ˈlɔːjə(r)/,律师,defence lawyer;see a lawyer;lawyer's advice,She spoke to a lawyer before signing the contract.,签合同前她咨询了律师。,attorney;solicitor,,law + yer：精通法律并代理人的专业人士。
1488,suspect,A2,verb; noun,/səˈspekt/; /ˈsʌspekt/,怀疑；嫌疑人,suspect that;prime suspect;suspect of,Police have identified a suspect in the robbery case.,警方已锁定抢劫案中的一名嫌疑人。,doubt;accused,trust,动词重音在后；名词嫌疑人重音多在前。
1489,cup,A2,noun,/kʌp/,杯子；奖杯,cup of tea;World Cup;plastic cup,Would you like a cup of tea or coffee?,你想喝杯茶还是咖啡？,mug;trophy,,cup：小容量饮具，也指冠军奖杯。
1490,description,A2,noun,/dɪˈskrɪpʃn/,描述；说明,job description;detailed description;description of,Please write a short description of your favourite place.,请简短描述一下你最喜欢的地方。,account;portrayal,,describe → description：用语言画出事物。
1491,confidence,A2,noun,/ˈkɒnfɪdəns/,信心；信任,gain confidence;in confidence;confidence in,Public speaking practice can build your confidence.,演讲练习能增强你的信心。,self-assurance;trust,doubt,con + fidence：内心笃定可信。
1492,industrial,A2,adj.,/ɪnˈdʌstriəl/,工业的,industrial area;industrial revolution;industrial waste,Old industrial buildings have become art studios.,旧工业建筑已变成艺术工作室。,manufacturing;factory-related,agricultural,industry → industrial：与工厂生产相关。
1493,complain,A2,verb,/kəmˈpleɪn/,抱怨；投诉,complain about;complain to;complain of,Customers complain about slow internet service.,顾客抱怨网络服务太慢。,grumble;protest,praise,complain：把不满说出来。
1494,perspective,A2,noun,/pəˈspektɪv/,视角；观点,from the perspective of;new perspective;in perspective,Try to see the problem from another person's perspective.,试着从别人的视角看这个问题。,viewpoint;angle,,per + spective：从哪一边看出去。
1495,error,A2,noun,/ˈerə(r)/,错误；误差,make an error;human error;error message,I found an error in the second column of the table.,我在表格第二列发现了一个错误。,mistake;fault,accuracy,error：偏离正确结果的偏差。
1496,arrest,A2,verb; noun,/əˈrest/,逮捕；阻止,under arrest;arrest someone;house arrest,The police arrested two men after the bank robbery.,银行抢劫后警方逮捕了两名男子。,detain;capture,release,arrest：依法把人扣下。
1497,assess,A2,verb,/əˈses/,评估；评定,assess risk;assess progress;assess the damage,Teachers assess students' progress throughout the term.,老师在整学期评估学生的进步。,evaluate;judge,,assess：量一量值多少、进度如何。
1498,register,A2,verb; noun,/ˈredʒɪstə(r)/,登记；注册；名册,register for;register online;cash register,Please register for the course before Friday.,请在周五前注册这门课程。,enrol;record,,register：把名字写进正式名单。
1499,asset,A2,noun,/ˈæset/,资产；宝贵品质,financial asset;valuable asset;assets and liabilities,Good communication skills are a valuable asset at work.,良好的沟通技能是工作中的宝贵资产。,resource;advantage,liability,asset：能帮你增值或取胜的东西。
1500,signal,A2,noun; verb,/ˈsɪɡnəl/,信号；示意,traffic signal;send a signal;signal that,A red traffic signal means you must stop.,红色交通信号表示你必须停下。,sign;indicate,,signal：传出“该怎么做”的讯息。
